{
  "schema": "company-os.release-scope.v1",
  "project_id": "example-project",
  "program_id": "example-program",
  "program_version": 1,
  "definition_version": 1,
  "cycle_id": "example-cycle-1",
  "master_task_id": "example-master-1",
  "outcome_digest": "0000000000000000000000000000000000000000000000000000000000000000",
  "deliverables": [
    {
      "deliverable_id": "core-release",
      "manager_task_id": "core-release-manager-1",
      "criticality": "required",
      "outcome_contribution": "The minimum decision-useful company outcome."
    },
    {
      "deliverable_id": "optional-enhancement",
      "manager_task_id": "optional-enhancement-manager-1",
      "criticality": "optional",
      "outcome_contribution": "An enhancement that may be omitted without changing the core promise."
    }
  ],
  "policy": {
    "required_failure": "block_release",
    "optional_failure": "omit_without_quality_relaxation",
    "max_optional_recovery_chains": 1
  },
  "accepted_design_decision": {
    "path": "evidence/release-scope-design-decision.v1.json",
    "sha256": "0000000000000000000000000000000000000000000000000000000000000000"
  }
}
